{
  "$schema": "https://json-schema.org/draft/2020-12/schema",
  "$id": "https://example.invalid/schemas/taxonomy.schema.json",
  "title": "Career taxonomy",
  "type": "object",
  "additionalProperties": false,
  "required": [
    "schemaVersion",
    "areas",
    "kinds"
  ],
  "properties": {
    "$schema": {
      "type": "string"
    },
    "schemaVersion": {
      "const": 1
    },
    "areas": {
      "type": "array",
      "minItems": 1,
      "items": {
        "type": "object",
        "additionalProperties": false,
        "required": [
          "slug",
          "label",
          "description",
          "order"
        ],
        "properties": {
          "slug": {
            "type": "string",
            "pattern": "^[a-z0-9]+(?:-[a-z0-9]+)*$"
          },
          "label": {
            "type": "string",
            "minLength": 2,
            "maxLength": 80
          },
          "description": {
            "type": "string",
            "minLength": 20,
            "maxLength": 300
          },
          "order": {
            "type": "integer",
            "minimum": 0
          }
        }
      }
    },
    "kinds": {
      "type": "array",
      "minItems": 1,
      "items": {
        "type": "object",
        "additionalProperties": false,
        "required": [
          "value",
          "label",
          "description"
        ],
        "properties": {
          "value": {
            "type": "string",
            "pattern": "^[a-z0-9]+(?:-[a-z0-9]+)*$"
          },
          "label": {
            "type": "string",
            "minLength": 2,
            "maxLength": 80
          },
          "description": {
            "type": "string",
            "minLength": 15,
            "maxLength": 240
          }
        }
      }
    },
    "localizations": {
      "$ref": "public-localizations.schema.json#/$defs/taxonomy"
    }
  }
}
