{
  "$schema": "../../schemas/taxonomy.schema.json",
  "schemaVersion": 1,
  "areas": [
    {
      "slug": "frontend-architecture",
      "label": "Frontend Architecture",
      "description": "UI foundations, rendering systems, design systems, and maintainable frontend structure.",
      "order": 1
    },
    {
      "slug": "backend-architecture",
      "label": "Backend Architecture",
      "description": "Services, APIs, domain boundaries, asynchronous workflows, and backend runtime design.",
      "order": 2
    },
    {
      "slug": "product-engineering",
      "label": "Product Engineering",
      "description": "Turning product goals into usable, maintainable, and measurable software.",
      "order": 3
    },
    {
      "slug": "system-design",
      "label": "System Design",
      "description": "End-to-end architecture, tradeoffs, boundaries, scalability, and integration design.",
      "order": 4
    },
    {
      "slug": "authentication-security",
      "label": "Authentication & Security",
      "description": "Identity, authorization, secure integration, and application security controls.",
      "order": 5
    },
    {
      "slug": "observability-reliability",
      "label": "Observability & Reliability",
      "description": "Telemetry, diagnostics, resilience, failure handling, and production confidence.",
      "order": 6
    },
    {
      "slug": "developer-experience",
      "label": "Developer Experience",
      "description": "Tooling, automation, standards, workflows, and systems that improve engineering effectiveness.",
      "order": 7
    },
    {
      "slug": "data-databases",
      "label": "Data & Databases",
      "description": "Data modeling, storage, querying, migrations, and data-intensive application design.",
      "order": 8
    },
    {
      "slug": "cloud-infrastructure",
      "label": "Cloud & Infrastructure",
      "description": "Deployment, hosting, delivery, cloud services, and operational architecture.",
      "order": 9
    },
    {
      "slug": "ai-engineering",
      "label": "AI Engineering",
      "description": "AI-assisted products, agent workflows, retrieval, generation, and evaluation systems.",
      "order": 10
    },
    {
      "slug": "performance",
      "label": "Performance",
      "description": "Runtime efficiency, loading behavior, profiling, and system-level performance improvements.",
      "order": 11
    },
    {
      "slug": "accessibility",
      "label": "Accessibility",
      "description": "Inclusive interaction, semantic interfaces, assistive technology support, and accessible product quality.",
      "order": 12
    },
    {
      "slug": "leadership",
      "label": "Technical Leadership",
      "description": "Technical direction, decision-making, coordination, mentoring, and engineering alignment.",
      "order": 13
    },
    {
      "slug": "commerce",
      "label": "Commerce",
      "description": "Commerce platforms, payments, storefront architecture, and transaction-oriented product systems.",
      "order": 14
    },
    {
      "slug": "mobile",
      "label": "Mobile",
      "description": "Mobile product architecture, native integration, responsive behavior, and device-specific experiences.",
      "order": 15
    }
  ],
  "kinds": [
    {
      "value": "architecture",
      "label": "Architecture",
      "description": "A substantial system, boundary, or technical-direction effort."
    },
    {
      "value": "improvement",
      "label": "Improvement",
      "description": "A meaningful enhancement to quality, maintainability, experience, or capability."
    },
    {
      "value": "investigation",
      "label": "Investigation",
      "description": "A structured diagnosis or evaluation that produced evidence and direction."
    },
    {
      "value": "launch",
      "label": "Launch",
      "description": "A product, feature, platform, or operational capability brought into use."
    },
    {
      "value": "leadership",
      "label": "Leadership",
      "description": "Technical direction, coordination, mentoring, or decision ownership."
    },
    {
      "value": "learning",
      "label": "Learning",
      "description": "A practical learning effort that produced reusable understanding or artifacts."
    },
    {
      "value": "project",
      "label": "Project",
      "description": "A coherent product, tool, experiment, or platform built over time."
    },
    {
      "value": "reliability",
      "label": "Reliability",
      "description": "Work that improved diagnostics, resilience, recoverability, or operational safety."
    },
    {
      "value": "research",
      "label": "Research",
      "description": "Technical exploration, comparison, or prototyping used to reduce uncertainty."
    }
  ],
  "localizations": {
    "pt-BR": {
      "areas": [
        {
          "slug": "frontend-architecture",
          "label": "Arquitetura Frontend",
          "description": "Fundações de interface, sistemas de renderização, design systems e estruturas frontend sustentáveis."
        },
        {
          "slug": "backend-architecture",
          "label": "Arquitetura Backend",
          "description": "Serviços, APIs, limites de domínio, fluxos assíncronos e desenho de runtimes backend."
        },
        {
          "slug": "product-engineering",
          "label": "Engenharia de Produto",
          "description": "Transformação de objetivos de produto em software útil, sustentável e mensurável."
        },
        {
          "slug": "system-design",
          "label": "Arquitetura de Sistemas",
          "description": "Arquitetura ponta a ponta, decisões técnicas, limites, escalabilidade e desenho de integrações."
        },
        {
          "slug": "authentication-security",
          "label": "Autenticação e Segurança",
          "description": "Identidade, autorização, integrações seguras e controles de segurança em aplicações."
        },
        {
          "slug": "observability-reliability",
          "label": "Observabilidade e Confiabilidade",
          "description": "Telemetria, diagnóstico, resiliência, tratamento de falhas e confiança em produção."
        },
        {
          "slug": "developer-experience",
          "label": "Experiência de Desenvolvimento",
          "description": "Ferramentas, automação, padrões e fluxos que aumentam a efetividade da engenharia."
        },
        {
          "slug": "data-databases",
          "label": "Dados e Bancos de Dados",
          "description": "Modelagem, armazenamento, consultas, migrações e desenho de aplicações orientadas a dados."
        },
        {
          "slug": "cloud-infrastructure",
          "label": "Nuvem e Infraestrutura",
          "description": "Deploy, hospedagem, entrega, serviços de nuvem e arquitetura operacional."
        },
        {
          "slug": "ai-engineering",
          "label": "Engenharia de IA",
          "description": "Produtos com IA, fluxos de agentes, recuperação de informação, geração e avaliação."
        },
        {
          "slug": "performance",
          "label": "Desempenho",
          "description": "Eficiência em runtime, carregamento, profiling e melhorias de desempenho sistêmico."
        },
        {
          "slug": "accessibility",
          "label": "Acessibilidade",
          "description": "Interações inclusivas, interfaces semânticas, tecnologias assistivas e qualidade acessível."
        },
        {
          "slug": "leadership",
          "label": "Liderança Técnica",
          "description": "Direção técnica, tomada de decisão, coordenação, mentoria e alinhamento de engenharia."
        },
        {
          "slug": "commerce",
          "label": "Comércio Digital",
          "description": "Plataformas de comércio, pagamentos, arquitetura de lojas e sistemas transacionais."
        },
        {
          "slug": "mobile",
          "label": "Mobile",
          "description": "Arquitetura de produtos mobile, integrações nativas, responsividade e experiências específicas por dispositivo."
        }
      ],
      "kinds": [
        {
          "value": "architecture",
          "label": "Arquitetura",
          "description": "Um esforço relevante de sistema, limites ou direção técnica."
        },
        {
          "value": "improvement",
          "label": "Melhoria",
          "description": "Uma evolução relevante de qualidade, manutenção, experiência ou capacidade."
        },
        {
          "value": "investigation",
          "label": "Investigação",
          "description": "Um diagnóstico ou uma avaliação estruturada que produziu evidências e direcionamento."
        },
        {
          "value": "launch",
          "label": "Lançamento",
          "description": "Um produto, recurso, plataforma ou capacidade operacional colocado em uso."
        },
        {
          "value": "leadership",
          "label": "Liderança",
          "description": "Direção técnica, coordenação, mentoria ou responsabilidade por decisões."
        },
        {
          "value": "learning",
          "label": "Aprendizado",
          "description": "Um esforço prático de aprendizado que produziu conhecimento ou artefatos reutilizáveis."
        },
        {
          "value": "project",
          "label": "Projeto",
          "description": "Um produto, ferramenta, experimento ou plataforma desenvolvida ao longo do tempo."
        },
        {
          "value": "reliability",
          "label": "Confiabilidade",
          "description": "Trabalho que aprimorou diagnóstico, resiliência, recuperação ou segurança operacional."
        },
        {
          "value": "research",
          "label": "Pesquisa",
          "description": "Exploração, comparação ou prototipação técnica usada para reduzir incerteza."
        }
      ]
    }
  }
}
